<?xml version="1.0" encoding="utf-8"?>
<brands xmlns:xsi="http://www.w3.org/2001/XMLSchema-instance"
    xsi:noNamespaceSchemaLocation="../schemas/schema-5.xsd">
    <brand id="ex:Brand1">
        <name xml:lang="en">Logitech</name>
        <companyEmail>support@logitech.com</companyEmail>
        <product id="ex:Product1">
            <price>50</price>
            <name xml:lang="en">Logitech MX Keys</name>
            <sale>0</sale>
            <VAT>21</VAT>
        </product>
    </brand>
    <brand id="ex:Brand2">
        <name xml:lang="en">AMD</name>
        <companyEmail>support@amd.com</companyEmail>
        <product id="ex:Product2">
            <price>100</price>
            <name xml:lang="en">AMD Ryzen 5 7600</name>
            <sale>20</sale>
            <VAT>21</VAT>
        </product>
        <product id="ex:Product3">
            <price>150</price>
            <name xml:lang="en">AMD Ryzen 7 5700X3D</name>
            <sale>20</sale>
            <VAT>21</VAT>
        </product>
    </brand>
    <brand id="ex:Brand3">
        <name xml:lang="en">TSMC</name>
        <companyEmail>support@tsmc.com</companyEmail>
    </brand>
</brands>